<?xml version="1.0" encoding="utf-8" ?>
<Datatable xmlns:xsi="http://www.w3.org/2001/XMLSchema-instance" xmlns:xsd="http://www.w3.org/2001/XMLSchema" xsi:noNamespaceSchemaLocation="../Schemas/HackingOperationOutcomeDefinition.xsd">

  <!-- ####################### -->
  <!-- ## BEST/HOME EFFECTS ## -->
  <!-- ####################### -->

  <HackingOperationOutcomeSetDefinition Name="HackingOperationOutcomeSeeFleets" Composition="Any" Level="1">
    <GameSettingPrerequisite    Flags="Prerequisite,Discard,UnlockAvailability">AllowPVPHacking,True</GameSettingPrerequisite>
    <PathPrerequisite Flags="Discard">EmpireTypeMajor</PathPrerequisite>
    <InterpreterPrerequisite Flags="Discard" Inverted="false">Path(Target,@'../ClassEmpire,EmpireTypeMajor')</InterpreterPrerequisite>
    <InterpreterPrerequisite Flags="Discard" Inverted="false">Path(Target,@'ClassColonizedStarSystem,BestSystem')</InterpreterPrerequisite>
    <InterpreterPrerequisite Flags="Discard" Inverted="true">$(IsTraceOperation)</InterpreterPrerequisite>
    <HackingOperationOutcomeDefinitionReference Name="HackingOperationOutcomeSeeFleetsSubEffect"/>
    <HackingOperationOutcomeDefinitionReference Name="HackingOperationOutcomeSpawnTraitorsSubEffect"/>
  </HackingOperationOutcomeSetDefinition>

  <!--<HackingOperationOutcomeDiplomaticPressureEffectDefinition Name="HackingOperationOutcomeSeeFleetsSubEffect" Hidden="true" Level="1">
    <DiplomaticEffectReference Name="FleetVisionOnInitiator"/>
  </HackingOperationOutcomeDiplomaticPressureEffectDefinition>

  <HackingOperationOutcomeSpawnTraitorsDefinition Name="HackingOperationOutcomeSpawnTraitorsSubEffect" Hidden="true" Level="0">
  </HackingOperationOutcomeSpawnTraitorsDefinition>-->


  <HackingOperationOutcomeSetDefinition Name="HackingOperationOutcomeEmpireRebellion" Composition="Any" Level="1">
    <PathPrerequisite Flags="Discard">EmpireTypeMajor</PathPrerequisite>
    <GameSettingPrerequisite    Flags="Prerequisite,Discard,UnlockAvailability">AllowPVPHacking,True</GameSettingPrerequisite>
    <InterpreterPrerequisite Flags="Discard" Inverted="false">Path(Target,@'../ClassEmpire,EmpireTypeMajor')</InterpreterPrerequisite>
    <InterpreterPrerequisite Flags="Discard" Inverted="false">Path(Target,@'ClassColonizedStarSystem,BestSystem')</InterpreterPrerequisite>
    <InterpreterPrerequisite Flags="Discard" Inverted="true">$(IsTraceOperation)</InterpreterPrerequisite>
    <HackingOperationOutcomeDefinitionReference Name="HackingOperationOutcomeEmpireRebellionSubEffect"/>
    <HackingOperationOutcomeDefinitionReference Name="HackingOperationOutcomeSetPoliticsSubEffect"/>
  </HackingOperationOutcomeSetDefinition>

  <!--<HackingOperationOutcomeEmpireRebellionDefinition Name="HackingOperationOutcomeEmpireRebellionSubEffect" Hidden="true" Level="1">
    <InterpreterPrerequisite Flags="EmpireAlreadyInAnarchy" Inverted="true">Path(Target,@'../ClassEmpire/ClassSenate,GovernmentAnarchy')</InterpreterPrerequisite>
    <InterpreterPrerequisite Flags="GovernmentCannotFall"   Inverted="true">Path(Target,@'../ClassEmpire/ClassSenate,GovernmentDictatorshipCravers')</InterpreterPrerequisite>
  </HackingOperationOutcomeEmpireRebellionDefinition>

  <HackingOperationOutcomeSetPoliticsDefinition Name="HackingOperationOutcomeSetPoliticsSubEffect" Power="30" Hidden="true" Level="0">
  </HackingOperationOutcomeSetPoliticsDefinition>-->


  <HackingOperationOutcomeSetDefinition Name="HackingOperationOutcomePreventFleetsMovement" Composition="Any" Level="1">
    <GameSettingPrerequisite    Flags="Prerequisite,Discard,UnlockAvailability">AllowPVPHacking,True</GameSettingPrerequisite>
    <PathPrerequisite Flags="Discard">EmpireTypeMajor</PathPrerequisite>
    <InterpreterPrerequisite Flags="Discard" Inverted="false">Path(Target,@'../ClassEmpire,EmpireTypeMajor')</InterpreterPrerequisite>
    <InterpreterPrerequisite Flags="Discard" Inverted="false">Path(Target,@'ClassColonizedStarSystem,BestSystem')</InterpreterPrerequisite>
    <InterpreterPrerequisite Flags="Discard" Inverted="true">$(IsTraceOperation)</InterpreterPrerequisite>
    <HackingOperationOutcomeDefinitionReference Name="HackingOperationOutcomePreventFleetsMovementSubEffect"/>
    <HackingOperationOutcomeDefinitionReference Name="HackingOperationOutcomeWoundHeroSubEffect"/>
  </HackingOperationOutcomeSetDefinition>

  <!--<HackingOperationOutcomeTemporaryEffectDefinition Name="HackingOperationOutcomePreventFleetsMovementSubEffect" Hidden="true" Level="1">
    <TemporaryEffectReference Name="FleetsImmobilization"/>
  </HackingOperationOutcomeTemporaryEffectDefinition>

  <HackingOperationOutcomeWoundHeroDefinition Name="HackingOperationOutcomeWoundHeroSubEffect" Hidden="true" Level="0">
  </HackingOperationOutcomeWoundHeroDefinition>-->


  <HackingOperationOutcomeSetDefinition Name="HackingOperationOutcomeSystemRebellion" Composition="Any" Level="1">
    <GameSettingPrerequisite    Flags="Prerequisite,Discard,UnlockAvailability">AllowPVPHacking,True</GameSettingPrerequisite>
    <PathPrerequisite Flags="Discard">EmpireTypeMajor</PathPrerequisite>
    <InterpreterPrerequisite Flags="Discard, IllegalOperationIsAcademyHomeSystem" Inverted="true">Path(Target,@'ClassColonizedStarSystem,AcademyHomeSystem')</InterpreterPrerequisite>
    <InterpreterPrerequisite Flags="Discard" Inverted="false">Path(Target,@'../ClassEmpire,EmpireTypeMajor')</InterpreterPrerequisite>
    <InterpreterPrerequisite Flags="Discard" Inverted="false">Path(Target,@'ClassColonizedStarSystem,BestSystem')</InterpreterPrerequisite>
    <InterpreterPrerequisite Flags="Discard" Inverted="true">$(IsTraceOperation)</InterpreterPrerequisite>
    <HackingOperationOutcomeDefinitionReference Name="HackingOperationOutcomeSystemRebellionSubEffect"/>
    <HackingOperationOutcomeDefinitionReference Name="HackingOperationOutcomePreventGroundBattlePlaysSubEffect"/>
  </HackingOperationOutcomeSetDefinition>

  <!--<HackingOperationOutcomeSystemRebellionDefinition Name="HackingOperationOutcomeSystemRebellionSubEffect" Hidden="true" Level="1">
    <InterpreterPrerequisite Flags="IllegalOperationIsAcademyHomeSystem" Inverted="true">Path(Target,@'ClassColonizedStarSystem,AcademyHomeSystem')</InterpreterPrerequisite>
  </HackingOperationOutcomeSystemRebellionDefinition>

  <HackingOperationOutcomeTemporaryEffectDefinition Name="HackingOperationOutcomePreventGroundBattlePlaysSubEffect" Hidden="true" Level="0">
    <TemporaryEffectReference Name="GroundBattlePlaysHacked"/>
  </HackingOperationOutcomeTemporaryEffectDefinition>-->


  <HackingOperationOutcomeSetDefinition Name="HackingOperationOutcomeStealTechnology" Composition="Any" Level="1">
    <GameSettingPrerequisite    Flags="Prerequisite,Discard,UnlockAvailability">AllowPVPHacking,True</GameSettingPrerequisite>
    <PathPrerequisite Flags="Discard">EmpireTypeMajor</PathPrerequisite>
    <InterpreterPrerequisite Flags="Discard" Inverted="true">Path(Context,@'../ClassEmpire,AffinityGameplayTemplars')</InterpreterPrerequisite>
    <InterpreterPrerequisite Flags="Discard" Inverted="false">Path(Target,@'../ClassEmpire,EmpireTypeMajor')</InterpreterPrerequisite>
    <InterpreterPrerequisite Flags="Discard" Inverted="false">Path(Target,@'ClassColonizedStarSystem,BestSystem')</InterpreterPrerequisite>
    <InterpreterPrerequisite Flags="Discard" Inverted="true">$(IsTraceOperation)</InterpreterPrerequisite>
    <HackingOperationOutcomeDefinitionReference Name="HackingOperationOutcomeStealTechnologySubEffect"/>
    <HackingOperationOutcomeDefinitionReference Name="HackingOperationOutcomeSpawnBackdoorSubEffect"/>
  </HackingOperationOutcomeSetDefinition>

  <!--<HackingOperationOutcomeStealTechnologyDefinition Name="HackingOperationOutcomeStealTechnologySubEffect" Hidden="true" Level="1">
  </HackingOperationOutcomeStealTechnologyDefinition>

  <HackingOperationOutcomeSpawnBackdoorDefinition Name="HackingOperationOutcomeSpawnBackdoorSubEffect" Hidden="true" Level="0">
  </HackingOperationOutcomeSpawnBackdoorDefinition>-->

  <HackingOperationOutcomeTurnTraitorsIntoSuperPopulationOnEmpireDefinition Name="HackingOperationOutcomeTurnTraitorsIntoSuperPopulationOnEmpire" Priority="1">
    <GameSettingPrerequisite    Flags="Prerequisite,Discard,UnlockAvailability">AllowPVPHacking,True</GameSettingPrerequisite>
    <PathPrerequisite Flags="Discard">EmpireTypeMajor,AffinityGameplayUmbralChoir</PathPrerequisite>
    <InterpreterPrerequisite Flags="Discard" Inverted="false">Path(Target,@'../ClassEmpire,EmpireTypeMajor')</InterpreterPrerequisite>
    <InterpreterPrerequisite Flags="Discard" Inverted="false">Path(Target,@'ClassColonizedStarSystem,BestSystem')</InterpreterPrerequisite>
    <InterpreterPrerequisite Flags="Discard" Inverted="true">$(IsTraceOperation)</InterpreterPrerequisite>
  </HackingOperationOutcomeTurnTraitorsIntoSuperPopulationOnEmpireDefinition>


  <!-- ####################### -->
  <!-- ##    BASIC EFFECT   ## -->
  <!-- ####################### -->

  <HackingOperationOutcomeSpawnTraitorsDefinition Name="HackingOperationOutcomeSpawnTraitors" Level="0">
    <PathPrerequisite Flags="Discard">EmpireTypeMajor</PathPrerequisite>
    <InterpreterPrerequisite Flags="Discard, IllegalOperationIsAcademyHomeSystem" Inverted="true">Path(Target,@'ClassColonizedStarSystem,AcademyHomeSystem')</InterpreterPrerequisite>
    <InterpreterPrerequisite Flags="Discard" Inverted="false">Path(Target,@'../ClassEmpire,EmpireTypeMajor')</InterpreterPrerequisite>
    <InterpreterPrerequisite Flags="Discard" Inverted="true">Path(Target,@'ClassColonizedStarSystem,BestSystem')</InterpreterPrerequisite>
    <InterpreterPrerequisite Flags="Discard" Inverted="true">$(IsTraceOperation)</InterpreterPrerequisite>
  </HackingOperationOutcomeSpawnTraitorsDefinition>

  <HackingOperationOutcomeSetPoliticsDefinition Name="HackingOperationOutcomeSetPolitics" Priority="0" Power="30" Level="0">